<?xml version="1.0"?>
<!DOCTYPE tank-battle SYSTEM "map.dtd">

<!--
 Copyright Â© 2008 Simone Spaccarotella
 
 This file is part of "Tank Battle Arena" game.
 
 Tank Battle is free software: you can redistribute it and/or modify
 it under the terms of the GNU General Public License as published by
 the Free Software Foundation, either version 3 of the License, or
 (at your option) any later version.
 
 Tank Battle Arena is distributed in the hope that it will be useful,
 but WITHOUT ANY WARRANTY; without even the implied warranty of
 MERCHANTABILITY or FITNESS FOR A PARTICULAR PURPOSE. See the
 GNU General Public License for more details.
 
 You should have received a copy of the GNU General Public License
 along with Tank Battle.  If not, see <http://www.gnu.org/licenses/>. 
 -->
 
<tank-battle>
	<map id="empty">
	</map>
	<map id="square" src-image="resource/images/brickWall-0.png" width="60" height="60">
		<wall x="100" y="100" />
		<wall x="100" y="160" />
		<wall x="100" y="220" />
	</map>
	<map id="prova" src-image="resource/images/brickWall-0.png" width="60" height="60">
		<wall x="100" y="100" />
		<wall x="100" y="160" />
		<wall x="100" y="220" />
		<wall x="100" y="300" />
	</map>
</tank-battle>